{"$defs":{"compositionEntry":{"additionalProperties":false,"properties":{"count":{"minimum":1,"type":"integer"},"marks_each":{"minimum":1,"type":"integer"},"type":{"enum":["mcq","very-short-answer","short-answer","long-answer","case-based"],"type":"string"}},"required":["type","count","marks_each"],"type":"object"},"section":{"additionalProperties":false,"properties":{"composition":{"items":{"$ref":"#/$defs/compositionEntry"},"minItems":1,"type":"array"},"id":{"description":"Section label as printed, e.g. 'A'.","type":"string"},"subtotal":{"description":"Marks carried by this section. Must equal the sum of count * marks_each across the composition.","minimum":1,"type":"integer"},"title":{"type":"string"}},"required":["id","title","subtotal","composition"],"type":"object"}},"$id":"https://example.org/paperforge/blueprint.schema.json","$schema":"https://json-schema.org/draft/2020-12/schema","additionalProperties":false,"description":"The pattern an examination paper must follow: total marks, sections, and the composition of each section by question type and marks.","properties":{"description":{"type":"string"},"duration":{"description":"Time allowed, as printed on the paper, e.g. '3 hours'.","type":"string"},"locale":{"default":"en-GB","description":"Spelling locale the auditor lints against.","enum":["en-GB","en-US"],"type":"string"},"long_answer_requires_word_limit":{"default":true,"description":"When true, every long-answer question in a paper spec must declare a word_limit. Set false for subjects (e.g. mathematics) where long answers are worked solutions rather than prose.","type":"boolean"},"name":{"description":"Human-readable name of the pattern, e.g. 'Secondary English - 80 marks'.","type":"string"},"sections":{"items":{"$ref":"#/$defs/section"},"minItems":1,"type":"array"},"total_marks":{"minimum":1,"type":"integer"}},"required":["name","total_marks","sections"],"title":"PaperForge Blueprint","type":"object"}