{"description":"A generic four-section mathematics paper: objective questions, short worked answers, longer problems, and extended problems. Long answers are worked solutions, so word limits are not required; the internal-choice and step-marking rules still apply.","duration":"3 hours","locale":"en-GB","long_answer_requires_word_limit":false,"name":"Secondary Mathematics Paper - 80 marks","sections":[{"composition":[{"count":20,"marks_each":1,"type":"mcq"}],"id":"A","subtotal":20,"title":"Objective Questions"},{"composition":[{"count":6,"marks_each":3,"type":"short-answer"}],"id":"B","subtotal":18,"title":"Short Answers I"},{"composition":[{"count":6,"marks_each":4,"type":"short-answer"}],"id":"C","subtotal":24,"title":"Short Answers II"},{"composition":[{"count":3,"marks_each":6,"type":"long-answer"}],"id":"D","subtotal":18,"title":"Long Answers"}],"total_marks":80}