{"description":"A generic three-section language paper: reading, writing, and literature/language study. One worked pattern for any board whose language paper totals 80 marks.","duration":"3 hours","locale":"en-GB","long_answer_requires_word_limit":true,"name":"Secondary Language Paper - 80 marks","sections":[{"composition":[{"count":5,"marks_each":1,"type":"mcq"},{"count":5,"marks_each":3,"type":"short-answer"}],"id":"A","subtotal":20,"title":"Reading"},{"composition":[{"count":4,"marks_each":5,"type":"long-answer"}],"id":"B","subtotal":20,"title":"Writing"},{"composition":[{"count":10,"marks_each":1,"type":"mcq"},{"count":6,"marks_each":3,"type":"short-answer"},{"count":2,"marks_each":6,"type":"long-answer"}],"id":"C","subtotal":40,"title":"Literature and Language Study"}],"total_marks":80}